내용,결과,,긍정 댓글 수,부정 댓글 수,중립 댓글 수
얀 센 남은 받아 거팩 트임,35.0의 확률로 긍정리뷰 입니다., 긍정리뷰 입니다.,,,
독감 사망자 정확한 통계 자료 없는 명대 추산 독감 사망자 백신 사망자 인과성 상인 정 안 되었으나 질병 상 반응 보고서 코로나 사망자 만 비교 해보는 이상하죠,34.42의 확률로 부정리뷰 입니다., 부정리뷰 입니다.,,,
코로나 치명 률 감기 낫습니다 이내 검사 대폭 늘려서 확 진자 늘어난 겁니다 배 증가,34.73의 확률로 긍정리뷰 입니다., 긍정리뷰 입니다.,,,
맞은 코로나 걸리는 확률 낮은데 부분 쏙 빼고 비교,34.05의 확률로 중립리뷰 입니다., 중립리뷰 입니다.,,,
과학 미신 믿는 사람,34.14의 확률로 중립리뷰 입니다., 중립리뷰 입니다.,,,
이지 않은 정비 교 할 거 면 백신 안 맞는 코로나 걸리는 확률 코로나 인해 사망 할 확률 백신 접종 후 백신 인해 사망 할 확률 해보는,37.91의 확률로 부정리뷰 입니다., 부정리뷰 입니다.,,,
그런 논리 백신 안 맞은 코로나 걸리는 확률 높아질 테,37.43의 확률로 부정리뷰 입니다., 부정리뷰 입니다.,,,
코로나 치명 률 며칠 전 프로 서로 떨어졌습니다 백신 맞은 죽는 사람 많은,36.34의 확률로 부정리뷰 입니다., 부정리뷰 입니다.,,,
코로나 절대 걸리는 않은 생각 하는 사람 의미 없는 통계 겠지만 번은 내게 코로나 올 거 생각 하는 사람 선택 지를 제공 하는 유용한 정보 봅니다만 뉴스 굳이 보고 댓글 쓰는 당연한 후자 아닌,34.77의 확률로 중립리뷰 입니다., 중립리뷰 입니다.,,,
코로나 치명 률 안 되는 그거 통계 나오는 언론 감추려고 하는 뭘 미신 대께 문 이세,34.17의 확률로 중립리뷰 입니다., 중립리뷰 입니다.,,,
김 깡,34.03의 확률로 긍정리뷰 입니다., 긍정리뷰 입니다.,,,
맞는 말씀 입니다 코로나 걸리는 확률 자체 극악 극악 확률 플러스 극악 치명 률 대비 해서 러시안룰렛 할 필요성 잇나요,34.32의 확률로 중립리뷰 입니다., 중립리뷰 입니다.,,,
절대 안 맞는,34.2의 확률로 중립리뷰 입니다., 중립리뷰 입니다.,,,
연세 되세요,34.03의 확률로 긍정리뷰 입니다., 긍정리뷰 입니다.,,,
김 세이셨습니다,34.03의 확률로 긍정리뷰 입니다., 긍정리뷰 입니다.,,,
코로나 걸리는 확률 곱 하면 낮은 데님 수준,34.21의 확률로 중립리뷰 입니다., 중립리뷰 입니다.,,,
수 포자 일으키기 초 졸이세요,34.93의 확률로 긍정리뷰 입니다., 긍정리뷰 입니다.,,,
코로나 아닌 백신 운 하면 밴 신 한참 잘못 만드는 임상실험 안 끝나는 걸 갖다 맞추는 있는,35.06의 확률로 부정리뷰 입니다., 부정리뷰 입니다.,,,
로미 병원 갔을 부작용 걱정 된다 했으면 의사 무심하게 맞은 전 모르는 하던 진짜 개 웃기는 사실 안 웃기는,33.93의 확률로 중립리뷰 입니다., 중립리뷰 입니다.,,,
완전한 건강했던 사람 백신 부작용 사망 게 아닌 지병 있던 사람 백신 부작용 합병증 생기는 병세 악화 되는 사망 경우 대부분 알 고 있는 아주 드물게 건강했던 사람 백신 부작용 사망 경우 있는 경우 영상 나오는 확률 적은 거 인과성 성인 성 안 되는 판정 보류 인 경우 지병 악화 인한 사망 백신 접종 인과성 조사해 본 입니다,36.77의 확률로 부정리뷰 입니다., 부정리뷰 입니다.,,,
맞은 말러 무식,33.97의 확률로 중립리뷰 입니다., 중립리뷰 입니다.,,,
박재형 건강한 고 백혈병 부작용 청원 올라온 따든 따 연도 소식 입니다,34.98의 확률로 긍정리뷰 입니다., 긍정리뷰 입니다.,,,
사탄 코로나 백신 때문 백혈병 걸리는 사람 없단다,33.98의 확률로 중립리뷰 입니다., 중립리뷰 입니다.,,,
사탄 해외 토픽 감 이지 정도 면 우리나라 만,34.99의 확률로 긍정리뷰 입니다., 긍정리뷰 입니다.,,,
네이버 검색 하면 나오는 기사 뉴스 우리나라 꺼 대한민국,34.03의 확률로 긍정리뷰 입니다., 긍정리뷰 입니다.,,,
기자 댓글 알바 언론 플레이 까시기 전 글 내리시고 까세요,35.0의 확률로 긍정리뷰 입니다., 긍정리뷰 입니다.,,,
코로나 죽는 사람 원래 기 질환 앓는 있던 사람 임 그런 사람 원래 계절 성 감기 사망 하는 사람 군 속 함,34.21의 확률로 중립리뷰 입니다., 중립리뷰 입니다.,,,
얀 센 접종 후 사망 군인,33.8의 확률로 긍정리뷰 입니다., 긍정리뷰 입니다.,,,
박재형 깨 문 확률,34.03의 확률로 긍정리뷰 입니다., 긍정리뷰 입니다.,,,
공감 합니다 맞는 코로나 걸리는 내 맞는 안 죽는다는 법도 없는 위험한 도박 싶진 않은 주변 백신 맞은 사람 일주일 몸살 앓는 힘들어하던 분 있는 별 후 신용 안 가보다,39.78의 확률로 부정리뷰 입니다., 부정리뷰 입니다.,,,
지인 어머니 백신 맞는 째 입원 중이 세 몸 기운 없는 일상생활 힘든 날 백신 예약 가능한 날짜 왔던 솔직히 고민 입니다,34.13의 확률로 중립리뷰 입니다., 중립리뷰 입니다.,,,
버틸 수 있는 만큼 버텨 보려,34.24의 확률로 긍정리뷰 입니다., 긍정리뷰 입니다.,,,
아닌 일반 독감 백 신도 확률 로만 따지면 감기 걸리는 먹는 약도 확률 게임 돌리는 거 감 기약 먹는 죽 확률 로또 맞은 확률 사람 로또 그거 무서운 감기 약 안 먹는 거 아닌,35.37의 확률로 부정리뷰 입니다., 부정리뷰 입니다.,,,
이세민 이세민 말씀 맞은 감기 코로나 다르다고 봐요 국가 전염병 잖아 요소 백신 맞는 거 당연한 거 게 아닌 수 없는 최선 선택 거,37.38의 확률로 부정리뷰 입니다., 부정리뷰 입니다.,,,
문재인 백신 확보 제대로 못 해서 백신 하는 힘든데 사람 백신 안 맞은 강경하게 하는 웃김 맞는 싶은 수량 부족한 디,37.93의 확률로 부정리뷰 입니다., 부정리뷰 입니다.,,,
안 맞은,34.06의 확률로 중립리뷰 입니다., 중립리뷰 입니다.,,,
퀸 맞는 싶은 않지만 맞은 화이자 모드 나도 없는,34.0의 확률로 중립리뷰 입니다., 중립리뷰 입니다.,,,
안 무서 우세 맞은 생각 하신다는 거 자체 대단하셔요,34.12의 확률로 부정리뷰 입니다., 부정리뷰 입니다.,,,
일루미나티 중반 진실 페 밀리 전 세계 돈 반 쥐락펴락한다 면 세계 자유롭겠어요 삼성 우리나라 위 있는 게 보이는 데,34.21의 확률로 긍정리뷰 입니다., 긍정리뷰 입니다.,,,
죄송한 데 정도 면 일상생활 불가할 같은 언급 아티스트 아닌 본인 조종 당 있는 같은 데 빠른 정신 차리고 본인 삶 살길 바람,34.04의 확률로 중립리뷰 입니다., 중립리뷰 입니다.,,,
기독교인 들이에 틀 안 활동 하는 거 안쓰럽긴 해도 그냥 모른 척 넘어갑시다,34.22의 확률로 중립리뷰 입니다., 중립리뷰 입니다.,,,
귀 있는 사람 듣겠죠,34.25의 확률로 중립리뷰 입니다., 중립리뷰 입니다.,,,
차원 어리어 쉬 존재 채널 꼭 보는 자작 입니다 깨어나세요,35.13의 확률로 긍정리뷰 입니다., 긍정리뷰 입니다.,,,
콘셉트 깅바,34.03의 확률로 긍정리뷰 입니다., 긍정리뷰 입니다.,,,
알루미나 티 음모론 아니라도 백신 맞은 하는 맞는 건 아닌 생각 함,36.77의 확률로 부정리뷰 입니다., 부정리뷰 입니다.,,,
용감한 있는 진실 말 해주시 정보 정확도 통찰 혜안 엄청나 신 특별하신 분 시 존경 합니다,34.36의 확률로 긍정리뷰 입니다., 긍정리뷰 입니다.,,,
주변 내 주변 아무렇게나 없더 주변 많니 아프다는 소리 드는 봤어도 마비 됐다는 소리 듣지를 못 했으면 인지 갑자기 나타나서 난리,35.11의 확률로 긍정리뷰 입니다., 긍정리뷰 입니다.,,,
현주 경고 하는 내 댓글 깝죽 거리 면 신고 조심해라,34.11의 확률로 긍정리뷰 입니다., 긍정리뷰 입니다.,,,
패 홍 선생 보는 사람 잘못 카더라 뉴스 살포 하는 게 본인 아니세요 진짜 지구 평평 걸 만큼 음모론 추정 하시네요,34.17의 확률로 중립리뷰 입니다., 중립리뷰 입니다.,,,
패 홍 선생 해당 주장 뒷받침 하는 외신 기사 논문 있는 원본 긁어오세요,34.28의 확률로 중립리뷰 입니다., 중립리뷰 입니다.,,,
이승현 보는 현주 초면 니니 거리 고 예의 못 갖추는 모습 안 보이세요 회사 담당 회계사 증상 의료인 얘기 가지 고 논문 써 와야 하는 녹음 본이라도 땄어야 하는 증명 하려는 댓글 단 줄 아십니까 주변 그런 얘기 사망자 비교 후유증 부작용 조사 해달라 거 아닙니까 불편하세요,34.3의 확률로 중립리뷰 입니다., 중립리뷰 입니다.,,,
글 제대로 읽어라 현주 많은 없는 내 들은 만도 벌써 건 회사 담당 회계사 화이자 접종 후 한쪽 다리 마비 증상 후 회복 진짜 놀라서 차 접종 심한 고민 지난주 회사 처 조카 지인 전신 마비 전 화이자 어제 카페 집 강아지 이쁘다고 얘기 하던 옆 테이블 의료인 병원 환자 명 화이자 접종 후 하반신 마비 초면 니니 거리 면서 함부로 지껄이는 마는 근거 없는 얘기 아닌,34.16의 확률로 중립리뷰 입니다., 중립리뷰 입니다.,,,
이승현 진짜 불편하시면 그냥 백신 맞은 부스터 샷 맞으셔서 절대 면역 형성 해주는 백신 맞은 효과 있던 국내외 신발 뉴스 보았지만 그냥 불안한 맞은 싫습니다 개인 의견 이니 논문 필요한 없는 귀가 차네 진짜 평소 대화 나누시는지 궁금한 주석 고 출처 공유 대화 하신,34.05의 확률로 중립리뷰 입니다., 중립리뷰 입니다.,,,
패 홍 선생 발작 하신 본인 말 맞은 증명 하신 웃기는 시,33.82의 확률로 중립리뷰 입니다., 중립리뷰 입니다.,,,
이승현 해드릴까 회계사 연락처 회사 연락처 드리는 봐요 근거 출처 잘 따지시는 말 지구 평평 음모 확인 해보는 주세요,35.09의 확률로 긍정리뷰 입니다., 긍정리뷰 입니다.,,,
주위 맞은 사람 보는 심장 무리 오던데 일주일 지난 지금 심장 찌릿찌릿하고 운동장 바퀴 달린 거 마냥 헉헉거린다네요 어머니 잘 생각 해보는 엄마 몸 약한 고혈압 높은 이상은 없는,34.05의 확률로 중립리뷰 입니다., 중립리뷰 입니다.,,,
백신 안 맞는 할까 개돼지 봄,35.92의 확률로 부정리뷰 입니다., 부정리뷰 입니다.,,,
코로나 죽는 사람 많을까 백신 죽는 사람 많을까 자꾸 백신 맞은 선동 하는 걸리는 국가 제약회사 카르텔 인류 인구 의도 줄이려고 아닌 뭘 까,37.49의 확률로 부정리뷰 입니다., 부정리뷰 입니다.,,,
코로나 걸리는 죽는 확률 백신 맞은 죽 확률 배 가까운 높은데요,35.86의 확률로 부정리뷰 입니다., 부정리뷰 입니다.,,,
화이자 임 상상 마친 소리,34.63의 확률로 긍정리뷰 입니다., 긍정리뷰 입니다.,,,
말 그대로 긴급 승인 백신 연구 보통 십 보는데 현재 화이자 백신 완전하다는 장담 못 단 뜻,34.13의 확률로 중립리뷰 입니다., 중립리뷰 입니다.,,,
최은영 맞은 살 결과 나오는 서두른 건 사실 자세하게 설명 해주셔서 감사한,33.81의 확률로 중립리뷰 입니다., 중립리뷰 입니다.,,,
사스 메르스 백신 없는 배신 해도 저항 하는 변 생기는 면 무용지물 안 만 듦 개발 비도 드는 사실 상 완치 아닌 그냥 중증 못 가게 하는 거 지 수많은 드는 급하게 나오는 건 맞은,38.42의 확률로 부정리뷰 입니다., 부정리뷰 입니다.,,,
아하하하하 사람 정복 병 천연 두 없는 실제 독감 있는 이유 해서 변형 되는 독감 바이러스 생겨나기 때문 백신 시기 일찍 나오는 게 맞는 국가 접종 권고 하는 만 본인 선택 중요하다고 생각 합니다 조심 이야기 보는,37.76의 확률로 부정리뷰 입니다., 부정리뷰 입니다.,,,
영하 콜드 체인 쇼 현실 그냥 냉장고,35.02의 확률로 긍정리뷰 입니다., 긍정리뷰 입니다.,,,
음식 관련 해서 알레르기 있거나 약물 알레르기 본인 몸 알레르기 있던 맞은 시 다시 번 고려 해보는 게 좋은 같은 멕시코 임상실험 결과 논문 보는 알레르기 있는 분 부작용 발생 했으면 나온 있는,34.09의 확률로 중립리뷰 입니다., 중립리뷰 입니다.,,,
옳소 옳소,34.03의 확률로 긍정리뷰 입니다., 긍정리뷰 입니다.,,,
이제 언론 못 믿어요,34.61의 확률로 긍정리뷰 입니다., 긍정리뷰 입니다.,,,
국뽕 빼세요 나란 나라 달라 생각 버리세요 이제 스스로 알아보는 몸 지키는 합니다,34.98의 확률로 긍정리뷰 입니다., 긍정리뷰 입니다.,,,
인정,35.54의 확률로 긍정리뷰 입니다., 긍정리뷰 입니다.,,,
모든 사람 백신 위험한,33.92의 확률로 중립리뷰 입니다., 중립리뷰 입니다.,,,
다시 헛소리 마세 백신 치료받는 제로 인구 늘 고 수명 길어진 세상 됐는데 특별히 나쁜 백 신입,33.65의 확률로 긍정리뷰 입니다., 긍정리뷰 입니다.,,,
강병현 백신 믿음 치료받는 제도 아닌,33.89의 확률로 중립리뷰 입니다., 중립리뷰 입니다.,,,
강병현 일반 백신 다르다고 보는데 긴급 승인 받고 나오는 걸 비교,33.85의 확률로 긍정리뷰 입니다., 긍정리뷰 입니다.,,,
강병현 급하게 나오는 백신 잖습니까 후유증 동반 할지도 모르는 데,33.76의 확률로 긍정리뷰 입니다., 긍정리뷰 입니다.,,,
감기 옮기는 건 괜찮고,34.01의 확률로 긍정리뷰 입니다., 긍정리뷰 입니다.,,,
무사히 차 맞는 살 고 있지만 걱정 해보는 하는,33.93의 확률로 중립리뷰 입니다., 중립리뷰 입니다.,,,
확 진자 동선 겹 치는 거 아는 건 옛날 아는 지 지금 동선 누가 체크,34.57의 확률로 긍정리뷰 입니다., 긍정리뷰 입니다.,,,
빨간 맛 맞춤법 지적 그리 잘 띄어쓰기 안 해주냐,33.87의 확률로 긍정리뷰 입니다., 긍정리뷰 입니다.,,,
백신 맞는 감염 퍼뜨린 사람,34.96의 확률로 부정리뷰 입니다., 부정리뷰 입니다.,,,
내 말,35.5의 확률로 긍정리뷰 입니다., 긍정리뷰 입니다.,,,
비하인드 같은 사람 불쌍하다 한국 집단 주의 세뇌 되는 자유 짓 밟히는 모르는 같은 사람 개돼지 하는 듯,34.08의 확률로 중립리뷰 입니다., 중립리뷰 입니다.,,,
코로나 주사 하나로 집단 주의 세뇌 뇌 대망 상이 쩔어계신 듯,34.73의 확률로 긍정리뷰 입니다., 긍정리뷰 입니다.,,,
공감 누름 요즘 생각 없는 사람 코로나 땜 좋은 감옥 썩어라 해도 알았다고 할 사람 들이죠,34.28의 확률로 중립리뷰 입니다., 중립리뷰 입니다.,,,
안 걸리겠지 안 걸리겠지 제대로 제대로,34.2의 확률로 중립리뷰 입니다., 중립리뷰 입니다.,,,
팩트 공감,34.63의 확률로 긍정리뷰 입니다., 긍정리뷰 입니다.,,,
차후 차도 늦데 맞는 되 기도 부작용 얘기 많은 들어서 취소,33.92의 확률로 긍정리뷰 입니다., 긍정리뷰 입니다.,,,
참고 내년 개발 될 거 예상 되는 백신 후유증 없거나 아예 없는 정도 티 안 난다고 함 주식 보 소식 빨 라서 난 거 맞은 존 버 탐,36.57의 확률로 부정리뷰 입니다., 부정리뷰 입니다.,,,
후 그게 인지 자세하게 알려주실 수 있나요,34.9의 확률로 긍정리뷰 입니다., 긍정리뷰 입니다.,,,
코로나 믿는 자저 세상 가는,34.09의 확률로 중립리뷰 입니다., 중립리뷰 입니다.,,,
후 국산 백신 말씀 이신 가는,33.84의 확률로 중립리뷰 입니다., 중립리뷰 입니다.,,,
러시안룰렛,35.54의 확률로 긍정리뷰 입니다., 긍정리뷰 입니다.,,,
솔직히 맞는 거 임 상 기간 이라 불안한 내년 상황 보고 맞을라고 했으면 부모님 존 강요 함 하루 종일 욕 쳐 먹는 예방접종 했으면 부작용 걸리는 그냥 내 인생 갈라 갑다 가야 지,34.31의 확률로 중립리뷰 입니다., 중립리뷰 입니다.,,,
후 부모님 눈치 줘서 접종 하기로 했네요 싸우는 피곤하니 그냥 맞는 집 나가던 가해야지,34.23의 확률로 중립리뷰 입니다., 중립리뷰 입니다.,,,
진짜 똥 고 집 아닌 거 설명 하려는 별의별 인터넷 자료 뒤져서 설명 했으면 별거 아닌 거 가지 고 속 썩이게 하는 반응 만 옴,34.17의 확률로 중립리뷰 입니다., 중립리뷰 입니다.,,,
김영준 생각 국내 바이오 사이언스 개발 일거 같은,34.97의 확률로 긍정리뷰 입니다., 긍정리뷰 입니다.,,,
랜덤 아닐 거 들어서 몸속 시 폭탄 넣었는데 거 터지는 랜덤 해놓은 경우 터지는 만 랜덤 이지 종국 필히 터지므로 터지는 랜덤 아닌 필수 유전자 조작 백신 아마 그런 것일 가능한 높죠,33.92의 확률로 중립리뷰 입니다., 중립리뷰 입니다.,,,
죽는 챔 임 안 진다는 진짜 국민 위 맞는 무책임 방언 쏟아내는 게 현,34.1의 확률로 중립리뷰 입니다., 중립리뷰 입니다.,,,
백신 샀는데 저걸 인정 버리면 거부 하는 사람 많아지니까 인정 안 하는 듯 산 거소 비는 해보는 하는,35.19의 확률로 부정리뷰 입니다., 부정리뷰 입니다.,,,
맨 땅 헤딩 죽는 의혹 누가 만드는,34.89의 확률로 긍정리뷰 입니다., 긍정리뷰 입니다.,,,
사기꾼 백신 팔이 공개 하지 않은 당연한 음모론 몰아가고요 딥스들 그래요,33.79의 확률로 긍정리뷰 입니다., 긍정리뷰 입니다.,,,
안 맞은 임상실험 영원히 안 끝나는 코로나 백신 영원히 못 만드는 않겠니,36.16의 확률로 부정리뷰 입니다., 부정리뷰 입니다.,,,
이세민 죽는 책임지는,34.46의 확률로 긍정리뷰 입니다., 긍정리뷰 입니다.,,,
그냥 코로나 걸리는 거,34.37의 확률로 긍정리뷰 입니다., 긍정리뷰 입니다.,,,
코로나 모의고사 보셨군 고 스트레스 받을 힘내세요,34.67의 확률로 긍정리뷰 입니다., 긍정리뷰 입니다.,,,
부작용 지코 나가는 아닌,34.24의 확률로 긍정리뷰 입니다., 긍정리뷰 입니다.,,,
부작용 심하셨네 혹 창 꼭 맞은 않길 바라는 대미 코로나 걸리는 사망 할 확률 입니다,34.04의 확률로 중립리뷰 입니다., 중립리뷰 입니다.,,,
개 같은 이어 대면 책임지는 회피 보상 안 해주는,33.91의 확률로 중립리뷰 입니다., 중립리뷰 입니다.,,,
군대 죽는 거 개쥭음,34.18의 확률로 중립리뷰 입니다., 중립리뷰 입니다.,,,
백신 맞은 알레르기 반응 죽는 로또 맞은 확률 높은 듯,35.24의 확률로 부정리뷰 입니다., 부정리뷰 입니다.,,,
군대 그냥 죽는 억울한데 군대 백신 맞는 죽는,33.86의 확률로 중립리뷰 입니다., 중립리뷰 입니다.,,,
백신 접종 개월 정도 됐나 사이 백신 접종 후 사망자 명 건 사망률 상당히 높은 거두게 다가 사지 마비 심각한 부작용 경미한 부작용 합 하면 심한,34.22의 확률로 중립리뷰 입니다., 중립리뷰 입니다.,,,
하호 안 맞은 되는 선택 유일,34.96의 확률로 부정리뷰 입니다., 부정리뷰 입니다.,,,
하호 어차피 백신 거저 올 데 모든 후 백신 회사 상관없는 나라 책임지기로 보상 하는 싫으니 대책 마련 거,34.16의 확률로 부정리뷰 입니다., 부정리뷰 입니다.,,,
주변 누가 죽었냐,34.63의 확률로 긍정리뷰 입니다., 긍정리뷰 입니다.,,,
레지옹 안 믿으면 며칠 살 걸 대에 주운 가족 애통할까,33.9의 확률로 중립리뷰 입니다., 중립리뷰 입니다.,,,
사실 경우 있는 건강 체크 하려는 종합 검진 받다가 암 걸린 기도 함,34.33의 확률로 긍정리뷰 입니다., 긍정리뷰 입니다.,,,
국민 바보 맞은 요소 사람 지금 많은,33.77의 확률로 중립리뷰 입니다., 중립리뷰 입니다.,,,
애초 모든 의약품 부작용 있는 게 다가 백신 엄청난 단기간 개발 되었기에 심하겠죠 그럼에도 불구 맞는 이유 코로나 죽 확률 획기 낮춰주기 때문 입니다 그게 본질 좋은 맞는 게 아닌 수 맞는 거 고요,35.41의 확률로 부정리뷰 입니다., 부정리뷰 입니다.,,,
평생 집안 두문불출 할 기세 입니다,34.96의 확률로 긍정리뷰 입니다., 긍정리뷰 입니다.,,,
획기 이지 않은 거 같은,34.06의 확률로 긍정리뷰 입니다., 긍정리뷰 입니다.,,,
점점 확 진자 나오는 걸리는 전 세계,34.19의 확률로 긍정리뷰 입니다., 긍정리뷰 입니다.,,,
가족 명 백신 맞는 죽는 딴 말 안 나오겠지 세상 그리 단순하면 걱정 이란 게 필요하냐 백신 접종 후 죽는 사람 명 넘는데 람 상관없는 사람 말 게 쉽게 하는,38.97의 확률로 부정리뷰 입니다., 부정리뷰 입니다.,,,
안 하는 문제 지 강제 백신 맞는 하려는 구상권 청구 압박 장난 아니게 하는,36.54의 확률로 부정리뷰 입니다., 부정리뷰 입니다.,,,
백신 맞은 죽는 억 배상 판결 있는 국민 신뢰 맞은 죽 확률 낮으니 안 죽으니깐 맞은 된다고 안심 시킨 함,35.45의 확률로 부정리뷰 입니다., 부정리뷰 입니다.,,,
구상권 청구 백신 안 맞은 하는 게 아닌 잘 알 고 비유 하신,37.24의 확률로 부정리뷰 입니다., 부정리뷰 입니다.,,,
박현준 이해력 딸리면 닥치고 있는 자율 맞은 말거나 하는 거 맞는 뒤지거나 살거나 본인 스스로 정 하는 비유 개 잣 있는,36.22의 확률로 부정리뷰 입니다., 부정리뷰 입니다.,,,
그냥 백신 좋으니 부작용 죽는 말 맞은 이거네요 전 세계 인 검증 덜 된 백신 실험 쥐네요,34.34의 확률로 부정리뷰 입니다., 부정리뷰 입니다.,,,
그러는 눈 가리고 국민 바보 멍청이 아는가 봄,35.0의 확률로 긍정리뷰 입니다., 긍정리뷰 입니다.,,,
그르 게 염 계산 참지 하는,34.03의 확률로 중립리뷰 입니다., 중립리뷰 입니다.,,,
어이없는 계산법,34.63의 확률로 긍정리뷰 입니다., 긍정리뷰 입니다.,,,
맞은 마라 누가 맞은 하는 계산 맞은,33.86의 확률로 중립리뷰 입니다., 중립리뷰 입니다.,,,
맞은 똑똑한 시,33.6의 확률로 중립리뷰 입니다., 중립리뷰 입니다.,,,
순수 맞은 하던 데,33.6의 확률로 중립리뷰 입니다., 중립리뷰 입니다.,,,
순수 아저씨 모르면,35.0의 확률로 긍정리뷰 입니다., 긍정리뷰 입니다.,,,
게 맞은,34.21의 확률로 긍정리뷰 입니다., 긍정리뷰 입니다.,,,
백신 안 맞은 마스크 끼 고 경제 침체 상황 무한 유지 걸 가정 해보는 됨 코로나 걸리는 확률 이란 게 마스크 안 끼 면 싸 돌아다니는 백 프로,37.12의 확률로 부정리뷰 입니다., 부정리뷰 입니다.,,,
건강한 사람 백신 맞는 죽었는지 보는 본인 신고 했으면 믿음,34.97의 확률로 부정리뷰 입니다., 부정리뷰 입니다.,,,
내 봤다 넌 백신 개월 마다 맞은 안 골로 갈 확률 높은,35.36의 확률로 부정리뷰 입니다., 부정리뷰 입니다.,,,
우리나라 돌연 사망자 사망일 내 쌀밥 먹었다네요 쌀 돌연사 원인 입 같은 분 썩은 언론 코로나 사태 악화 원흉 들입니다,34.82의 확률로 긍정리뷰 입니다., 긍정리뷰 입니다.,,,
코로나 백신 죽는 사람 그냥 코로나 걸리는 죽 사람 여태 코로나 걸리는 사람 죽었냐 그냥 면역 좋고 튼튼한 사람 살 고 약한 사람 죽는 게 팩트 백신 맞은 불변 임,36.06의 확률로 부정리뷰 입니다., 부정리뷰 입니다.,,,
쌀 똑같나 건강한 사람 갑자기 백신 맞는 사망 하면 백신 문제 지 교통사고 외상 아닌,34.68의 확률로 부정리뷰 입니다., 부정리뷰 입니다.,,,
헬로키티 젊은 사람 돌연사 죽습니다,34.42의 확률로 긍정리뷰 입니다., 긍정리뷰 입니다.,,,
부작용 줄이는 백신 나오는 기다림,33.85의 확률로 중립리뷰 입니다., 중립리뷰 입니다.,,,
위너 크라운 정철 백신 전문가 백신 낫는 아닌 면역 낫는 거 함,34.15의 확률로 중립리뷰 입니다., 중립리뷰 입니다.,,,
백신 맞는 시인 죽는 백신 탓 지 전 부대 깨문 이냐,34.12의 확률로 중립리뷰 입니다., 중립리뷰 입니다.,,,
백신 맞은 사람 천만 명 넘기는 거기 사망자 수가 명 코로나 걸리는 사람 만 명 거기 명 사망자 수 만 명과 만 명의 비교 당연한 만 명 쪽 많은 맞은 않은 순전히 궁금해서 그럽니다 주 뒤 백신 접종 심히 고민 입니다,37.21의 확률로 부정리뷰 입니다., 부정리뷰 입니다.,,,
