내용,결과,,긍정 댓글 수,부정 댓글 수,중립 댓글 수
백신 접종 후 사망 하신 사람 신고 안 하신 분 수치 계산 안 하셨네요 친 인척 백신 후 분 돌아가는 원인 알 수 없는 신고 안 했기에 통계 치 들어가지 않은 이지 회사 부고 있는 경우 보는 신고 분 못 받습니다 대다수 신고 안 하는 애원 인 모르는 병 사망 하는 백신 인과성 없는 말 하기에도 모순 인 같은,36.33의 확률로 부정리뷰 입니다., 부정리뷰 입니다.,,,
백신 생명 위태롭 게 하는 지금 접종 없는 하는 분도 개월 마다 접종 하면 고통 받는 순번 다가오죠,35.1의 확률로 부정리뷰 입니다., 부정리뷰 입니다.,,,
진짜 백신 안 맞은 음식점 여행 못 가게 되는 시스템 되면 억지로 맞은 하는 사회 환경 분위기 맞는 되는 후유증 사망 이면 책임지는 안 짐,39.2의 확률로 부정리뷰 입니다., 부정리뷰 입니다.,,,
백신 접종 예약 했지만 솔직히 부작용 생기는 맞은 무서워 코로나 걸리는 나라 격리 시키고 치료받는 해주는데 백신 부작용 생기는 면 나라 모름 책임지는 회피 하잖아요,36.22의 확률로 부정리뷰 입니다., 부정리뷰 입니다.,,,
국민 드는 일어나야 하는 생각 합니다 주사 맞은 분 안 면역체계 파괴 되 서서 서희 죽은 합니다 정말 말세 같은 앞 무서운 일어난다 고 합니다 두려운 세상 입니다,34.38의 확률로 부정리뷰 입니다., 부정리뷰 입니다.,,,
불안한 백신 안 맞는 안정 될 개인 조심한 나쁘지 않다고 보는 죽는 불안함을 택할 이유 없으며 강요 타당 하지 않다고 보는,35.04의 확률로 부정리뷰 입니다., 부정리뷰 입니다.,,,
살 입니다 차 접종 후 이틀 차 몽롱 오한 미열 있었지만 감기 수준 이라 심한 아프진 않은 약 먹는 잠 만 잤습니다 일차 흉통 하루 번 분 있는 가끔 나오는 흉통 이라 대수롭지 않은 생각 했으면 지금 주차 고 지금 가슴 찌르고 조이는 느낌 흉통 되는 하루 신경 쓰이네요 아픈 땐 분 넘기는 아프고요 차는 안 맞은,35.2의 확률로 부정리뷰 입니다., 부정리뷰 입니다.,,,
화이자 백신 접종 후 귀한 쪽 멍멍해지기 시작 하더군 꼭 높은 산 올라가면 기압 차이 멍멍해지는 코 막 고 해보는 했으면 안 되더라고요 하루 지나면 괜찮은 하며 기다렸으나 나아지지 않은 멍멍하던 귀한 쪽 안 들리기 시작 병원 갔더니 원인 모른다네요 안 들리게 지낸 지 주 지금 잘 들리고 있는 나라 하는 말 병원 갔던 영수증 진료 확인 내 라인 성 확인 후 병원 비 주겠다네요 차는 안 맞은 살 화이자 백신 후기 입니다,38.24의 확률로 부정리뷰 입니다., 부정리뷰 입니다.,,,
백신 맞은 안 맞은 대단한 스트레스 임,36.79의 확률로 부정리뷰 입니다., 부정리뷰 입니다.,,,
나오는 백신 맞은 건 스스로 마루타 참여 하는,36.21의 확률로 부정리뷰 입니다., 부정리뷰 입니다.,,,
백신 몸속 어혈 급격하게 늘리는 거 같은,33.78의 확률로 중립리뷰 입니다., 중립리뷰 입니다.,,,
독감 접종 맞은 매년 감기 걸리듯이 코로나 접종 해도 안 걸리는 보장 없을뿐더러 백신 급하게 나오는 만큼 부작용 위험한 부감 크다,38.02의 확률로 부정리뷰 입니다., 부정리뷰 입니다.,,,
정말 답답하고 슬프다 인간 무지 인해 죽는 않은 될 생명 안정 성 확정 되는 않은 미완성 백신 맞는 사망 하는구나,34.11의 확률로 부정리뷰 입니다., 부정리뷰 입니다.,,,
백신 접종 반대 하는 분 맞은 세계 일부 양심 있는 의료 계 분 백신 위험한 외치 고 있지만 묵살 당하는 현실 입니다,37.28의 확률로 부정리뷰 입니다., 부정리뷰 입니다.,,,
백신 맞은 코로나 걸리는 죽 확률 백신 맞은 죽 확률 두 가지 되는 거,35.1의 확률로 부정리뷰 입니다., 부정리뷰 입니다.,,,
면역 약한 기 질환 있는 사람 백신 절대 맞은 안 되는 같은 건강한 사람 미세한 부작용 잘 견뎌내 부모님 가까운 되시는데 건강하십니다,37.74의 확률로 부정리뷰 입니다., 부정리뷰 입니다.,,,
맞은 싫다는 사람 강제 맞는 하는 안 되는 접종 후 죽는 사람 나오는 마당 인과성 없는 하면 끝 인,39.52의 확률로 부정리뷰 입니다., 부정리뷰 입니다.,,,
통계 아래 내용 포함 되면 좋은 젊은 층 기 질환 없는 경우 사망률 코로나 사망률 분모 검사 받지 않은 확 진자 수가 빠져 있는 감염 부정 사회 시선 검사 기피 가능한 많은 오차 있던 추정 치를 포함 해보는 됨이의 포함 코로나 걱정 야외 활동 자제 하는 사람 사망률 판단 되는 배차 건 신뢰 하는 어렵네요 사람 백신 꺼리는 이유 코로나 조심한 건강 관리 잘 기 질환 없는 감염 후 건강 관 리 잘 하면 나을 수 있던 믿음 있는 반해서 백신 치명 부작용 발생 할 경우 걸 해결 할 방법 제시 하지 못 하는 때문 생각 합니다,35.98의 확률로 부정리뷰 입니다., 부정리뷰 입니다.,,,
거 바뀌어야 함지 모른다고 인과성 인정 하지 않은 게 아닌 반대 명확하게 사인 백신 때문 아닌 당국 증명 하지 못 하면 인정 해보는 함,33.77의 확률로 중립리뷰 입니다., 중립리뷰 입니다.,,,
전대 여자 고 화이자 차 맞는 부정 출혈 생기는 고 생리 주기 깨졌어요 산부인과 백신 때문 인 지는 모른다고 백신 맞은 전 부작용 있는 수 있던 말 안 해주더라고 정말 놀랐습니다,38.43의 확률로 부정리뷰 입니다., 부정리뷰 입니다.,,,
사회 죽는 책임지는 수 없는 개인 선택 존중 되는 합니다 아닌 싶은 못 맞는 그런 분 마스크 필수 술집 단체 모임 스스로 조심한 하는,35.01의 확률로 부정리뷰 입니다., 부정리뷰 입니다.,,,
확률 계산 간과 점 있는 백신 내 맞은 결정 해서 맞는 것이므 백신 접종 수 대비 사망자 수로 계산 하는 게 맞은 코로나 걸리는 죽 확률 앞 다가 코로나 걸리는 확률 곱 해보는 하는 입니다 현재 실질 확 진자 수 전체 인 구토 치사 율 되는 입니다 백신 접종 후 사망 확률 코로나 죽 확률 배 높게 나오는 계산 되는 신중하게 계산 하여 보도 했으면 좋은,38.84의 확률로 부정리뷰 입니다., 부정리뷰 입니다.,,,
내 아는 의료인 맞은 사실 안 맞은 함 경우 많데요 외부 맞은 할 수 없는 상황 많다고 함 의료 상당히 백신 불신 있던 함 의료 사이 의견 갈린다고 하는,36.06의 확률로 부정리뷰 입니다., 부정리뷰 입니다.,,,
부작용 부작용 국민 가장 염려 맞는 걸 기피 하는 이유 인과성 인정 잘 안 해주기 때문 백신 인해 사망 가능한 커 보이는데도 불구 인과성 인정 하지 않은 질병 관리 청 보는 실망 감 백신 불안감 커진 거,37.31의 확률로 부정리뷰 입니다., 부정리뷰 입니다.,,,
인구 감축 프로젝트 성 맞는 맞은 않은 불이익 준 대잖아,33.94의 확률로 중립리뷰 입니다., 중립리뷰 입니다.,,,
백신 중지 젊은 사람 생명 지킬 수 해결 책 자연면역 빠른 치료받는 정상 생활 돌아가는 길이,33.83의 확률로 중립리뷰 입니다., 중립리뷰 입니다.,,,
대체 코로나 걸리는 확률 대략 계산 안 하는 통계 합산 기간 생각 하면 백신 위험한 게 팩트,35.98의 확률로 부정리뷰 입니다., 부정리뷰 입니다.,,,
백신 맞는 사망 사람 백신 아닌 기 질환 의한 코로나 걸리는 사망 했으면 하는 사람 코로나 죽는 아닌 기 질환 죽는 고 로코 사람 죽이는 바이러스 아닌 결론 내리는 보이네요,36.87의 확률로 부정리뷰 입니다., 부정리뷰 입니다.,,,
직장 압박 주면서 강제 거나 의무 화하는 거 처벌 했으면 좋겠음 추후 물량 풍부해져도 절대 국가 차원 강제 못 하는 해보는 하는 생각,34.38의 확률로 중립리뷰 입니다., 중립리뷰 입니다.,,,
백신 맞는 안 맞는 개인 자유 입니다 언론 사회 분위기 조성 개인 권리 침해 하도록 편파 보도 하지 마세요 사망자 유가족 저작 사망 확률 수치 의미 있는,36.17의 확률로 부정리뷰 입니다., 부정리뷰 입니다.,,,
내 생각 그러하다 뉴스 기사 동의 젠 코로나 걸리는 죽는 확률 백신 맞는 급성 죽 확률 높겠다 내 갖는 있는 소신 정말 현명했다는 걸 느낀다,35.04의 확률로 부정리뷰 입니다., 부정리뷰 입니다.,,,
백신 위험한 건 멀쩡한 사람 백신 맞는 아파도 모르는 쇠 일관 하는 때문 이지,35.38의 확률로 부정리뷰 입니다., 부정리뷰 입니다.,,,
인과성 성인 성 안 된다는 거 소름,34.13의 확률로 중립리뷰 입니다., 중립리뷰 입니다.,,,
미 접종 백신 강요 하지 마라 압박 강요 하는 책임지는 회피 불편 감수 방역 수 칙 철저히 지키는 왔던,34.22의 확률로 부정리뷰 입니다., 부정리뷰 입니다.,,,
백신 맞는 죽 바 코로나 걸리는 게 살 확률 높다,35.37의 확률로 부정리뷰 입니다., 부정리뷰 입니다.,,,
접종 후 부작용 무섭지만 중장 기적 인 부작용 무섭다 들면 접종 후 개월 후 누가 심각한 부작용 겪는다면 코로나 백신 맞은 사람 불안한 살겠는가 지금 주류 언론 거기 나오는 전문가 사람 못 믿는 세상 입니다 도생 시대 입니다,36.65의 확률로 부정리뷰 입니다., 부정리뷰 입니다.,,,
깨달음 대한민국 국민 착한 게 아닌 멍청한 거,34.24의 확률로 중립리뷰 입니다., 중립리뷰 입니다.,,,
얀 센 백신 접종 로서 맞는 나서 당일 입술 부어 오르고 알레르기 반응 생기다가 이후 알레르기 두드려 기 반응 주 회 반응 있는 백신 맞은 전 알레르기 반응 일절 없다가 이제 알레르기 약 늘 챙기고 다니네요 개인 접종 로서 드리는 말씀 최대한 늦은 맞는 게 좋은 게 생각 입니다,38.35의 확률로 부정리뷰 입니다., 부정리뷰 입니다.,,,
본인 삶은 본인 선택 하는 이니 부디 백신 접종 분위기 강요 아닌 선택 몰아 갔으면 좋은,34.66의 확률로 부정리뷰 입니다., 부정리뷰 입니다.,,,
아는 분조 문민 번 가는 왔던 아버지 괜찮아서 다행 시기 상조 생각 함,34.98의 확률로 긍정리뷰 입니다., 긍정리뷰 입니다.,,,
코로나 사망 청년 못 봤네요 주변 코로나 시작 해서 지금 세한 분 돌아갔네 접종 유도 기사 냈으면 합니다 이제 점점 실체 드러나는데 웬만하면 그만하자 화가 납니다,34.06의 확률로 중립리뷰 입니다., 중립리뷰 입니다.,,,
코로나 걸리는 진짜 사망 하는 확률 계산 하는 어려운 거 아닌 반면 백신 맞자마자 안 되는 사망자 속출,37.29의 확률로 부정리뷰 입니다., 부정리뷰 입니다.,,,
코로나 현재 감기 수준 입니다 걸리는 자가면역 치료받는 되는 현재 백신 사망자 많습니다 부작용 힘든 사람 많은 언론 중립 지키길,34.06의 확률로 중립리뷰 입니다., 중립리뷰 입니다.,,,
백신 의무 아닌 현재 지병 있거나 컨디션 나쁘거나 막연한 불안감 있던 안 맞은 되는 국가 권고 것일 선택 본인 몫 입니다 백신 안 맞은 아무렇게나 욕 안 건강해서 접종 했으면,36.98의 확률로 부정리뷰 입니다., 부정리뷰 입니다.,,,
코로나 백신 기대했었는데 젠 백신 두려운 현실 솔직히 백신 만들긴 만들었지만 급하게 만드는 같은 느낌 듭,33.89의 확률로 긍정리뷰 입니다., 긍정리뷰 입니다.,,,
소름 돋는 게 코로나 바이러스 시작 된 게 연월 약 개월 정도 이동 안 코로나 인한 사망자 명 백신 개발 연월 쯤 완료 안됨 백신 인한 사망자 명 코로나 있었던 기간 긴데도 사망자 많은 건 백신 인한 사망 무서운,34.09의 확률로 중립리뷰 입니다., 중립리뷰 입니다.,,,
기 질환 없는 경우 확률 계산 해보는 기 질환 없는 사람 기준 코로나 치명 률 백신 치명 률 비교 하면 백신 치명 률 높은 듯,34.02의 확률로 중립리뷰 입니다., 중립리뷰 입니다.,,,
근대 멀떵 사람 백신 맞는 사망 거 보는 사람 유가족 억울하고 후회 스러울까,34.82의 확률로 부정리뷰 입니다., 부정리뷰 입니다.,,,
지방 코로나 걸리는 확률 적고 백신 대충 만들어서 백신 죽은 아픈 가능한 높은 듯,34.15의 확률로 중립리뷰 입니다., 중립리뷰 입니다.,,,
암 환자 전문 치료받는 하는 미국 전문 의사 말 의하면 백신 접종 후 그동안 안정 되었던 암 환자 하루아침 사이 나쁜 상황 급 전환 사망자 증가 기존 암 환자 만 아닌 원인 모르는 새로운 암 환자 급증 몸 난데없는 혹 생기는 고 병 빠른 진행 되는 결과 나오기도 전 사망 하는 케이스 발견 되는 있는,36.18의 확률로 부정리뷰 입니다., 부정리뷰 입니다.,,,
살면서 체 번 없는 백신 맞고부터 만 먹어도 소화 잘 안 되는 체함,34.36의 확률로 부정리뷰 입니다., 부정리뷰 입니다.,,,
이준석 전 세월호 선장 있는 일부 학생 아닌 만히 있는 죽잖아 나가야겠다 선생 학생 전문가 코로나 백신 사태 치 환하면 의료 진 방역 당국 인 선장 있으라는데 나가는 위험한 죽는 결과 있던 사망 말 안 듣는 뛰 쳐 나가는 소수 생존,35.74의 확률로 부정리뷰 입니다., 부정리뷰 입니다.,,,
정말 학생 대는 득 실 큽니다 실제 감염 률 산정 하면 사망률 비슷한 코로나 내 조심 할 수 있지만 백신 스스로 위험한 노출 시킨다는 점 위험한 잘 판단 하신,33.73의 확률로 중립리뷰 입니다., 중립리뷰 입니다.,,,
모든 지 개 돼지 피해 보는 법대 처 하는 법 국제 의원 맞는 맞은 됨 국 의원 나라 버린다 나라 위기 인 거임,34.29의 확률로 중립리뷰 입니다., 중립리뷰 입니다.,,,
백신 왕따 문화 사람 죽입니다 무지 웬 수입,33.8의 확률로 중립리뷰 입니다., 중립리뷰 입니다.,,,
백신 개월 마다 맞은 하는 건 생각 안 하시나 완전한 백신 나오기 전 맞은 생각 없는,38.62의 확률로 부정리뷰 입니다., 부정리뷰 입니다.,,,
지금 백신 부작용 보고 만 건 넘어 중증 사례 보고 만천 건 방송 끝 부분 나오는 백신 접종 후 사망 분 명 백신 사망 안정 건단 건,34.02의 확률로 중립리뷰 입니다., 중립리뷰 입니다.,,,
질병 관리 청장 식약청 대통령 백신 먼저 시범 맞는 코로나 환자 기침 할 앞 있는 해서 진짜 백신 효과 있는 코로나 감염 안 돼 고향 후년 몸 부작용 없는 맞는 거 생각 해볼게요,38.26의 확률로 부정리뷰 입니다., 부정리뷰 입니다.,,,
백신 사망 이유 있었을 거 코로나 사망 기존 지병 모르겠고 코로나 때문 사망 하신 코로나 무서워,33.85의 확률로 중립리뷰 입니다., 중립리뷰 입니다.,,,
갑자기 뒤 부작용 발현 되는 지금 코로나 사망자 많은 사망자 낼지도,34.2의 확률로 중립리뷰 입니다., 중립리뷰 입니다.,,,
목숨 입니다 불안정한 백신 맞은 감기 정도 위험한 률 지닌 코로나 걸릴지 선택 본인 몫 입니다,34.52의 확률로 부정리뷰 입니다., 부정리뷰 입니다.,,,
접종 했으면 시 소 중증 반응 나서 당일 응급치료 받고 후두 통 주일 치료받았는데 지금 가끔 두통 느껴집니다 치료받는 비 보상 진본 기준 차트 정수 개 모자라서 거부 당했습니다 그러면서 차는 제외 분류 되는 거부 당했습니다,34.09의 확률로 중립리뷰 입니다., 중립리뷰 입니다.,,,
욕조 곡선 베스 튜브 제품 개발 되면 초기 원인 모르는 고장 문제 있기 마련 업그레이드 수정 나가면서 안정화 되는 가는 최소 걸립니다 지금 많은 분 화 해주시 고 계시 고 내후년 쯤 화이자 모드 아스 트 카 지금 백신 맞은 부작용 기반 업그레이드 된 백신 나오는 겁니다 안정화 될 백신 맞는 게 맞은 듯 하는,36.01의 확률로 부정리뷰 입니다., 부정리뷰 입니다.,,,
백신 이란 게 의무 인 분위기 였지 독감 유행 하는 독감 백신 안 맞은 사람 제한 없는 내 알기 론 백신 맞은 코로나 전염 성은 있는 걸리는 증상 경 증 완치 되는 효과 있는 아는 가끔 사람 백신 코로나 치료받는 제인 듯 착각 하는 거 같기도 내 몸 승인 됐든 말 금 나온 있는 백신 갖고는 항체 만들기 싫다는데 사회 제한 해가며 무언 압박 주는 건 잘못 인,39.48의 확률로 부정리뷰 입니다., 부정리뷰 입니다.,,,
백신 안 맞은 백신 맞는 심장 통증 호소 거나 갑자기 열나고 몸 살기 있는 두통 호소 봤다 백신 맞는 사망 분도 보았다 절대 안 맞는,36.34의 확률로 부정리뷰 입니다., 부정리뷰 입니다.,,,
백신 부작용 걱정 되는 건 사실 안 맞는 거 낫는 말 맞는 백신 건강했으면 좋은 백신 부작용 없었으면 좋은 코로나 힘드실 힘내세요,35.82의 확률로 부정리뷰 입니다., 부정리뷰 입니다.,,,
틀 박힌 인과성 이야기 하지 백신 접종 전 특별히 아프지 않은 좋은 컨디션 이었는데 백신 접종 후 사망자 중증 환자 된 사람 조사 하여 국민 소상히 밝혔으면 좋은,34.43의 확률로 부정리뷰 입니다., 부정리뷰 입니다.,,,
사망률 백신 맞은 않은 사람 월등히 많은 건 인정 백신 맞은 사람 후유증 고려 하지 않은 통계 게 문제,36.88의 확률로 부정리뷰 입니다., 부정리뷰 입니다.,,,
의사 연구 부족한 질병 대해 알 면 안다고 단정 말,34.96의 확률로 긍정리뷰 입니다., 긍정리뷰 입니다.,,,
부작용 안 겪다 보는 사람 몰라요 고통 요원 인 불가라 책임지는 내 몫 백신 설명 백지 하는 백지 인 약품 누가 책임지는 지나간,35.31의 확률로 부정리뷰 입니다., 부정리뷰 입니다.,,,
인과성 있던 해도 없는 하는 되있음 래야 사회 돌아가니까,34.04의 확률로 중립리뷰 입니다., 중립리뷰 입니다.,,,
나중 큰 문제 발생 해보는 정신 차리지 고등학교 매우 불안정하다 배웠다 연구실 냉동 보관 하지 않은 합성 시키지가 동일하게 변형 되는 게 아니기에 부작용 거 과학 인 관계 상식 생각 해봐라 난 기 질환 있는 안 맞은 생각 하는 뭐라 해도 상관없는 내 선택,36.95의 확률로 부정리뷰 입니다., 부정리뷰 입니다.,,,
시위 하신 분파 문신 가슴 닿는 믿음 주네,35.05의 확률로 긍정리뷰 입니다., 긍정리뷰 입니다.,,,
결론 백신 맞는 나서 죽는 게 팩트 접종 안 상태 사람 짧은 안 죽는 게 가능할까 코로나 질병 사망 숫자 작년 크로나 발병 초기 지금 누적 되는 숫자 초등학생 차이 알 수 있는 같은 끝 백신 관련 없는 하는 게 상식 말 되는 건지 없는,40.24의 확률로 부정리뷰 입니다., 부정리뷰 입니다.,,,
세상 독감 주사 맞은 않은 살아왔는데,33.61의 확률로 중립리뷰 입니다., 중립리뷰 입니다.,,,
모든 감기 군 동물 오는 바이러스 세균 입니다 육식 채식 가장 안전한 예방 입니다 코로나 백신 사회 거리 마스크 소독 모임 제한 대해 서는 말 하는 음식 말 하지 않는 사람 모든 질병 인간 먹는 마는 할 먹는 만 지고 접촉 하는 관련 되는 있는 소 잃고 외양간 고치는 방법 만 해서 되풀이 해결 방법 없는,36.06의 확률로 부정리뷰 입니다., 부정리뷰 입니다.,,,
실제 영국 코로나 걸렸어도 검사 안 사람 많은 때문 실제 치명 률 내려갑니다,34.13의 확률로 중립리뷰 입니다., 중립리뷰 입니다.,,,
강요 맞은 말아야지 잘 못 되면 누가 책임지는 지나간 맞는 후회 할 하지 말아야지 답답한 사람,35.1의 확률로 부정리뷰 입니다., 부정리뷰 입니다.,,,
백신 절대 안 맞는 코로 나를 조심한 말 지,34.12의 확률로 중립리뷰 입니다., 중립리뷰 입니다.,,,
목숨 부작용 인해서 잘 못 되면 책임지는 않으니까 안 맞으려는 사람 입장 가는 차 접종 예약 완료,34.21의 확률로 중립리뷰 입니다., 중립리뷰 입니다.,,,
백신 늦은 맞은 백신 인과성 부족하잖아 병원 의사 모르겠다고 하는 건강한 내지 인도 직장 생활 잘 있던 백신 맞는 며칠 사망 했으면 인정 못 받은 부검 하는 하는 걸쭉 사람 힘들게 하는 같다고 그냥 포기 하던 심한 않거나 그냥 포기 사는 사람 많은 거,36.46의 확률로 부정리뷰 입니다., 부정리뷰 입니다.,,,
코로나 확 진자 사망률 코로나 걸리는 확률 계산 하셔야죠,34.23의 확률로 중립리뷰 입니다., 중립리뷰 입니다.,,,
지금 보건소 요양 병원 접종 독려 강요 있는 위 먼 지역별 보건소 마다 접종 률 실적 내 압박 하는 거 같은 강요 아니라면서 강요 하는,34.71의 확률로 중립리뷰 입니다., 중립리뷰 입니다.,,,
기자 강 정규 가족 차 맞은 꼭 후 아무런 부작용 장담 하시잖아요,33.83의 확률로 중립리뷰 입니다., 중립리뷰 입니다.,,,
코로나 코로 난데 백신 접종 후 부작용 생기는 운 맡겨야 게 불안합니다,33.96의 확률로 중립리뷰 입니다., 중립리뷰 입니다.,,,
전 세계 의사 처음 보는 바이러스 대해 백신 제조법 제대로 모르는 괜찮은 맞은 확신 주는 개 웃김,33.92의 확률로 부정리뷰 입니다., 부정리뷰 입니다.,,,
백신 접종 강요 하지 마라 심각한 부작용 사망 하면 책임지는 거,34.12의 확률로 중립리뷰 입니다., 중립리뷰 입니다.,,,
메느 컴 나오지 않은 의사 학생 백신 맞는 게 이해한 안 된다고 함,35.27의 확률로 부정리뷰 입니다., 부정리뷰 입니다.,,,
백신 접종 위험한 코로나 사망자 중환자 사망 거 코로나 때문 죽는 게 아닌 죽 되는 죽는 거,36.29의 확률로 부정리뷰 입니다., 부정리뷰 입니다.,,,
백신 맞는 안 사망 하면 무조건 백신 때문 임 개인 마다 유전체 구조 다른 때문 맞은 전 거부 반응 테스트 맞은 하는 급 조 백신 이라 그런 거 없는 차 맞은 차는 맞은 모르는 차 맞는 심장 두근거려서 불안한,37.61의 확률로 부정리뷰 입니다., 부정리뷰 입니다.,,,
후유 장해도 포함 시킨 된다고 생각 함,34.97의 확률로 긍정리뷰 입니다., 긍정리뷰 입니다.,,,
건강하던 분 접종 후 온몸 시퍼렇게 돌아가 심폐 혈증 결론 내리 만요,34.29의 확률로 긍정리뷰 입니다., 긍정리뷰 입니다.,,,
코로나 치명 률 떨어졌는데 기존 독감 전의 코로나 치명 률 비교 하면 백신 무의미한 아닌 기존 코로나 독감 치명 률 였을,33.8의 확률로 중립리뷰 입니다., 중립리뷰 입니다.,,,
코로나 걸리는 죽 확률 코로나 환자 사망자 비율 계산 하는 게 아닌 전체 인구 코로나 걸리는 확률 곱 해줘야 되는 때문 코로나 확 진자 수 전체 인구 수 곱 해서 계산 해보는 되는 게 맞는 거 같은 백신 맞은 인디 안 맞은 코로나 걸리는 죽 수도 있지만 아예 안 걸린 수도 있는,40.89의 확률로 부정리뷰 입니다., 부정리뷰 입니다.,,,
백신 접종 아닌 인구 감축 통제 하는 쉬운 백신 신분증 목적,34.75의 확률로 부정리뷰 입니다., 부정리뷰 입니다.,,,
백신 나쁜다는 게 아닌 차례 사망 사고 회피 하는 불신 생기는 무조건 백신 때문 아닌 감싸고 있는 정확한 조사 하는,35.34의 확률로 부정리뷰 입니다., 부정리뷰 입니다.,,,
인과성 없다가 아닌 모른 자겠죠 부작용 연구 적으니까,34.68의 확률로 긍정리뷰 입니다., 긍정리뷰 입니다.,,,
자이 백신 맞은 사람 안 맞은 사람 갈등 조장 시키겠지,36.63의 확률로 부정리뷰 입니다., 부정리뷰 입니다.,,,
퍼센트 중요한가요 죽 수도 있던 게 두려운 안 맞은 안 맞는 자유도 있는 하는 생각 합니다,38.54의 확률로 부정리뷰 입니다., 부정리뷰 입니다.,,,
백신 개발 원래 최 소년 임상실험 차 걸쳐서 상용 화 시킨다는데 나라 국민 대상 마루타 하는,33.84의 확률로 중립리뷰 입니다., 중립리뷰 입니다.,,,
코로나 인해 지금 많은 사람 고통 받고 있는 코로나 극복 하는 많은 노력 필요한 하는 때문 힘내서 코로 나를 극복 할 수 있었으면 좋은,34.53의 확률로 중립리뷰 입니다., 중립리뷰 입니다.,,,
정치인 언론인 의료인 믿지 마세 인생 선택 연속 선택 결과 책임지는 지면 되는 백신 예수 영접 본인 자유 의사 맡겨야죠 단 사전 공부 해야겠죠 의견 휘 둘리 지 말고요,33.91의 확률로 중립리뷰 입니다., 중립리뷰 입니다.,,,
