내용,결과,,긍정 댓글 수,부정 댓글 수,중립 댓글 수
인과성 없는 하지 인과성 없는 입증 해보는 사람 죽었는데 그냥 인과성 없는 주둥아리 만 털면 없는 게 되는 겨,34.11의 확률로 중립리뷰 입니다., 중립리뷰 입니다.,,,
부모님 공짜 꼭 맞은 하는 이스트라 차 맞은 내 말려도 안됨 차 걱정 됨 아무렇게나 문제 없는 할,34.21의 확률로 중립리뷰 입니다., 중립리뷰 입니다.,,,
수학 접근 퍼센트 놀이 하지 정확한 명 기준 명인 지 내고 일반인 수학 계산 해서 팩트 체크 하는 뉴스 결과 만 찍 내지 신뢰 할 수가 없는 명 기준 퍼센트 인지 건 야기 건 퍼센트 로만 표기 하는 누굴 바보,34.18의 확률로 중립리뷰 입니다., 중립리뷰 입니다.,,,
백신 낫 지,34.44의 확률로 긍정리뷰 입니다., 긍정리뷰 입니다.,,,
어린이 청년 건강한 중년 층 무증상 감기 증상 인 듯 데,34.99의 확률로 긍정리뷰 입니다., 긍정리뷰 입니다.,,,
꽤 아프다던데 안 맞은 모름,34.55의 확률로 부정리뷰 입니다., 부정리뷰 입니다.,,,
백신 맞는 명 사망 했으면 명 만 백신 사망자 인정 했으면 나머지 자연사,34.76의 확률로 부정리뷰 입니다., 부정리뷰 입니다.,,,
재 교수 유튜브 말 보 그럴 같기도 하던데 맞는 말 인지 모르는,33.97의 확률로 중립리뷰 입니다., 중립리뷰 입니다.,,,
백신 인해 일어난 아무렇게나 책임지는 주지 않은 일어날 수 있는 스스로 책임지는 하는 접종 후 일생 겨 남 탓 하는 사람 될 바 개인 방역 수칙 강화 코로나 막는 게 책임지는  있는 행동 인 듯 지금 변 쏟아지고 있는 상황 더욱 백신 의미 없는 봄 백신 맞은 퍼센트 해결 되는 아닌 치료받는 개발 될 기다리는 게 내 몸 유익할 듯 들도 백신 맞았든 안 맞았든 상관없는 개인 방역 수칙 꼭 지키는 정신 해이 해질 수록 내 몸 만 힘든 뿐입니다,39.77의 확률로 부정리뷰 입니다., 부정리뷰 입니다.,,,
죽는 말 백신 맞은 사람 맞은 되는 안 맞은 사람 안 맞은 되는 싸우는 백신 강요 해서 안 된다는 게 핵심 필자 백신 안 맞은 예정,34.81의 확률로 부정리뷰 입니다., 부정리뷰 입니다.,,,
해외 백신 맞는 죽는 사람 통계 있는 백신 해외 꺼 맞는 해외 사람 잭슨 맞는 죽었다는 소식 드는 본 없는,34.98의 확률로 부정리뷰 입니다., 부정리뷰 입니다.,,,
코로나 걸리는 다치자 무증상 치사 율 난리 정도 높으면 전철 안 방역 법 적용 안 하는 무증상 고 논리 맞는 게 게 코미디 그냥 독감 못 감기,35.7의 확률로 부정리뷰 입니다., 부정리뷰 입니다.,,,
맞는 싶은 사람 만 맞은 되는 굳이 맞은 싫은 사람 세금 낭비하면서 맞추려 하는 모든 게 강압 주 근로 그러더니,36.28의 확률로 부정리뷰 입니다., 부정리뷰 입니다.,,,
잘 살다가 백신 맞는 국내 사망자 만 명 상임 정보 꺼렸지요,33.78의 확률로 중립리뷰 입니다., 중립리뷰 입니다.,,,
백신 맞는 주 안 죽는 건 인과성 해주는 여지,36.14의 확률로 부정리뷰 입니다., 부정리뷰 입니다.,,,
부작용 생기는 면 보상 뭘 해주던 안 해주는 백신 맞아라니 웃기는 백신 사망률 코로나 치명 률 비교 하는 건 진짜,35.59의 확률로 부정리뷰 입니다., 부정리뷰 입니다.,,,
겁나면 안 맞은 되는 걱정 전 맞은,34.95의 확률로 부정리뷰 입니다., 부정리뷰 입니다.,,,
대한민국 국민 대부분 큰 작은 기 질환 가지 고 있는 기 질환 탓 보상 안 해주는 멀쩡한 백신 맞는 하반신 마비 사람 기 질환 이냐 고,37.59의 확률로 부정리뷰 입니다., 부정리뷰 입니다.,,,
엌 증자 코로나 후유증 어떤지 모르시나 보네 툭툭 털고 감기 열병 지나가는 줄 아는 가봨,34.7의 확률로 긍정리뷰 입니다., 긍정리뷰 입니다.,,,
백신 사망 연관 성 밝힘 기는 불가능,33.79의 확률로 긍정리뷰 입니다., 긍정리뷰 입니다.,,,
백신 맞는 거 식염수 대량 처 넣을까 걱정 된다,33.95의 확률로 부정리뷰 입니다., 부정리뷰 입니다.,,,
나이 대별 사망률 별 차이 없는,34.4의 확률로 긍정리뷰 입니다., 긍정리뷰 입니다.,,,
화이자 백신 몸 상태 랜덤 임차 몸살 인지 왼쪽 위로 못 올리고 몸살 인지도 올라가서 병원 못 가는 집 죽는 줄 알았어요 지금 라서 몸 뜨겁다는 거 몸 아픕니다,33.82의 확률로 중립리뷰 입니다., 중립리뷰 입니다.,,,
치명 률,34.63의 확률로 긍정리뷰 입니다., 긍정리뷰 입니다.,,,
백신 맞는 건강한 사람 죽었는데 인과성 없는 기 질환 있는 그것 땜 죽는 기 질환 멀쩡히 잘 살 고 있는 맞는 며칠 내 사망 이면 인과성 있는 없는 하는 건 뭡 못 밝히는 기 질환 탓 눈 감고,36.75의 확률로 부정리뷰 입니다., 부정리뷰 입니다.,,,
난이 뉴스 걸러 된다고 보는 거 뉴스 내 아는 그냥 원하는 대로 움직이는 뉴스 회사 다정 말 팩트 체크 아닌 선동 최고 뉴스 진짜 역대 뉴스 말 히스토리 만 보는 팩트 체크 게 뼈 하는 알 수 있는,34.32의 확률로 중립리뷰 입니다., 중립리뷰 입니다.,,,
차 접종 만 명 수치 자체 제일 구라 같다는 게 팩트,34.03의 확률로 중립리뷰 입니다., 중립리뷰 입니다.,,,
명 명 목숨 잃는다는 게 문제 지 죽은 적게 죽는 게 증 요하,34.52의 확률로 긍정리뷰 입니다., 긍정리뷰 입니다.,,,
맞은 괜찮은 차이니 맞은,33.91의 확률로 중립리뷰 입니다., 중립리뷰 입니다.,,,
그러고 보는 게 답 인 같은,34.43의 확률로 긍정리뷰 입니다., 긍정리뷰 입니다.,,,
청원 게시판 백신 맞는 중증 질환 걸리는 사망 하는 가족 글 보는 보건소 주치의 질병 관리 청 서로 떠 넘기고 발뺌 하는 바쁘다더라,35.2의 확률로 부정리뷰 입니다., 부정리뷰 입니다.,,,
젊은 사람 부작용 때문 고민 하는 노인 백신 맞자는 분위기 임,34.82의 확률로 부정리뷰 입니다., 부정리뷰 입니다.,,,
현 백신 접종 후 사망 사람 백신 안 맞은 사망 했으면 건 이해한 안 되는,37.06의 확률로 부정리뷰 입니다., 부정리뷰 입니다.,,,
맞는 이유 죽었으면 인정 해줘야지 억울한 맞 거,34.1의 확률로 중립리뷰 입니다., 중립리뷰 입니다.,,,
어떠한 게 숨기려는 같기도,34.05의 확률로 중립리뷰 입니다., 중립리뷰 입니다.,,,
아씨 주 일요일 화이자 접종 하는 날,34.23의 확률로 중립리뷰 입니다., 중립리뷰 입니다.,,,
마스크 잘 쓰는 다니는 살 면 그냥 맞은 마라 건강하다 뒤지는 팩트,33.97의 확률로 중립리뷰 입니다., 중립리뷰 입니다.,,,
화이자 회사 회장 안 맞았을까 좋은 거 면 일빠 맞은 긴급 승인 의미 인지 아는 사람 절대 안 맞은 나오는 전문가 란 사람 양심 찔리지 않은 모름 아닌 진짜 생각 하는,36.9의 확률로 부정리뷰 입니다., 부정리뷰 입니다.,,,
백신 부족하니까 언론 시작 하는,34.05의 확률로 부정리뷰 입니다., 부정리뷰 입니다.,,,
기사 제목 지으면 백신 불신 만 늘어날 듯 그로 적당히 끌어야지,33.81의 확률로 긍정리뷰 입니다., 긍정리뷰 입니다.,,,
요즘 게 멍청한 많은 접종 코로나 사망률 백신 사망률 접종 코로나 사망률 게 됨 백신 맞은 덜 아프다는 개 소리 하지 마시고 돌파 감염 말 자체 웃기니 애초 약 들어야 말 이지,36.34의 확률로 부정리뷰 입니다., 부정리뷰 입니다.,,,
국민 임상실험 대상 이지,35.54의 확률로 긍정리뷰 입니다., 긍정리뷰 입니다.,,,
개인 인 생각 마스크 잘 쓰는 사람 많은 되도록 안 가면 안 걸림 본인 그러고 있는 최근 병원 약국 안 간지 넘었으면 죽는 안 죽을지를 불안해하면서 백신 맞은 목숨 백 개임 죽는 아무렇게나 책임지는 안 짐 본인 만 억울하게 세상 사라지는 거임 참고 사람 마다 체질 달라 그것 단기간 만드는 백신 모든 사람 아무렇게나 없는 수가 없는 부작용 필연 그게 될 수 있던 거,37.58의 확률로 부정리뷰 입니다., 부정리뷰 입니다.,,,
글쎄 진짜 좀비 되려나,35.0의 확률로 긍정리뷰 입니다., 긍정리뷰 입니다.,,,
아니나 대지 만 자꾸 강요 하는 강제 맞은 필요한 없는 주사 맞는 죽는 누가 책임지는,36.01의 확률로 부정리뷰 입니다., 부정리뷰 입니다.,,,
안 맞은 거 고,34.2의 확률로 중립리뷰 입니다., 중립리뷰 입니다.,,,
급발진 소비자 증명 하는 거 별반 차이 없는 거 같은,34.23의 확률로 중립리뷰 입니다., 중립리뷰 입니다.,,,
인과성 없다를 정 하는 기준 밝히시길 못 밝히겠지만,34.06의 확률로 긍정리뷰 입니다., 긍정리뷰 입니다.,,,
어쨋든 사망자 있던 거 잖아,35.13의 확률로 긍정리뷰 입니다., 긍정리뷰 입니다.,,,
고 맞는 솔직히 독감 접종 아닌 거 확실한 아닌 인생 뒤지기 싫습니다 맞은 싫은 데 떡 해보는 하는,36.49의 확률로 부정리뷰 입니다., 부정리뷰 입니다.,,,
어제 접종 예약 했으면 갑자기 맞은 싫어지네,33.82의 확률로 부정리뷰 입니다., 부정리뷰 입니다.,,,
백신 위험한 거 맞은,33.93의 확률로 중립리뷰 입니다., 중립리뷰 입니다.,,,
명중 명도 코로나 때문 아니라니 신기하네,34.69의 확률로 긍정리뷰 입니다., 긍정리뷰 입니다.,,,
백신 접종 시작 못 나라 많은 나라 국민 보는 웃어 행복 고민 안타까운 생각 만 들어요 이상하게 색안경 끼 고 보고 백신 없는 의료 혜택 없는 대통령 좋은 나라 가세 이상한 헛소리 그만하는 백신 대안 있습니까,34.01의 확률로 중립리뷰 입니다., 중립리뷰 입니다.,,,
백신 예약 했으면 화나네,33.46의 확률로 중립리뷰 입니다., 중립리뷰 입니다.,,,
아픈 죽은 뭘 해줬냐,34.63의 확률로 긍정리뷰 입니다., 긍정리뷰 입니다.,,,
백신 맞는 죽는 사람 많은 건 사실 아닌,34.22의 확률로 중립리뷰 입니다., 중립리뷰 입니다.,,,
화이자 백신 안 맞은 거실 화,36.45의 확률로 부정리뷰 입니다., 부정리뷰 입니다.,,,
예약 했으면 안 맞은,34.06의 확률로 중립리뷰 입니다., 중립리뷰 입니다.,,,
난 안 맞은 무서운,34.06의 확률로 중립리뷰 입니다., 중립리뷰 입니다.,,,
뉴스 연대 먹혔지 내 몸 내 이니 책임지는 안질 거 면 맞은 마라,33.96의 확률로 중립리뷰 입니다., 중립리뷰 입니다.,,,
거참 인생 말랑말랑하게 사네 준전시나 다름없는 데 면 승부 걸어 볼 만 거 아닌 로또 주마 차이 피죽 인생 갈 넘은 길 가다가 죽는 내 죽는 사람 살겠지 하는 마음 그냥 처 맞는 주는 건 싫 지 내 맞기도 싫은 인생 어디있는 고민 만 하는 늙어 죽겠네,34.68의 확률로 중립리뷰 입니다., 중립리뷰 입니다.,,,
사망률 비교 하신 거 면 코로나 사망률 코로나 걸리는 확률 곱해 비교 해보는 하지 않은,34.21의 확률로 중립리뷰 입니다., 중립리뷰 입니다.,,,
죽는 운 나쁜,34.47의 확률로 긍정리뷰 입니다., 긍정리뷰 입니다.,,,
백신 확보 기 하는,34.11의 확률로 부정리뷰 입니다., 부정리뷰 입니다.,,,
선택 자유 입니다,35.34의 확률로 긍정리뷰 입니다., 긍정리뷰 입니다.,,,
인구 학살,34.63의 확률로 긍정리뷰 입니다., 긍정리뷰 입니다.,,,
저건 말 그대로 코로나 걸리는 사망률 임 코로나 안 걸리는 확률 생각 하면 치사 율 파면 안 맞는 게 생존 율 높겠네,34.73의 확률로 부정리뷰 입니다., 부정리뷰 입니다.,,,
산수 못 하는 사람 말 믿으면 안 됨,34.59의 확률로 부정리뷰 입니다., 부정리뷰 입니다.,,,
노래 만드는 사람 표절,34.14의 확률로 중립리뷰 입니다., 중립리뷰 입니다.,,,
나라 무조건 인과성 없는 우기잖아요 나라 하는 꼬락서니 보는 믿음 수가 없는 국가 믿고 백신 맞은 웃기는 소리,36.55의 확률로 부정리뷰 입니다., 부정리뷰 입니다.,,,
똥 싼다 처 맞는 끝나는,34.12의 확률로 중립리뷰 입니다., 중립리뷰 입니다.,,,
평소 건강한 사람 백신 맞는 호흡 가쁘 심장 쪽 따끔하다는 거 대미지 받았다는 겁니다 뼈 부러지면 다시 붙기라도 한번 충격 받은 심장 되돌릴 수 없는 인체 제일 중요한 부분 머리 심장,34.75의 확률로 부정리뷰 입니다., 부정리뷰 입니다.,,,
죽 되는 죽었다는 말 말 함부로 하는,34.2의 확률로 중립리뷰 입니다., 중립리뷰 입니다.,,,
안 맞은 되는 미 친 천지,34.85의 확률로 부정리뷰 입니다., 부정리뷰 입니다.,,,
인과성 성인 정지 끝 오리발 내 밀고 아닌 잡아떼면서,34.72의 확률로 긍정리뷰 입니다., 긍정리뷰 입니다.,,,
무 한심해요 시국,34.03의 확률로 긍정리뷰 입니다., 긍정리뷰 입니다.,,,
인과성 없는 건 이해한 안 된다 멀쩡하던 사람 백신 맞은 이후 죽었다면 인과성 있는,38.51의 확률로 부정리뷰 입니다., 부정리뷰 입니다.,,,
맞는 죽 수도 있는 인과성 인 정도 안 개죽음,34.67의 확률로 부정리뷰 입니다., 부정리뷰 입니다.,,,
낼 모래 맞은 되는 쓰까진 태양 난 군,33.88의 확률로 중립리뷰 입니다., 중립리뷰 입니다.,,,
난 차 맞는 멀쩡한 데 무서우면 안 맞은 되는,36.11의 확률로 부정리뷰 입니다., 부정리뷰 입니다.,,,
시끄럽고 백신 확보 얘기 하는,34.27의 확률로 부정리뷰 입니다., 부정리뷰 입니다.,,,
영화 감기 대사 생각나 치료받는 없는,34.8의 확률로 긍정리뷰 입니다., 긍정리뷰 입니다.,,,
노래 하이라이트,34.03의 확률로 긍정리뷰 입니다., 긍정리뷰 입니다.,,,
전문가 견 믿음 수 있는 부동산 전문가 코인 전문가 경제 전문가 특징 잘 알면서 돈 못 범골 명예 랍시고 위로,34.1의 확률로 긍정리뷰 입니다., 긍정리뷰 입니다.,,,
맞는 죽는 손해 교통사고 사망자 수가 많은,34.15의 확률로 중립리뷰 입니다., 중립리뷰 입니다.,,,
군대 합니다,34.63의 확률로 긍정리뷰 입니다., 긍정리뷰 입니다.,,,
영화 성 난 변호사 악역 나오는 제약회사 대표 대사 떠오르네 명 살릴 수 있는 명 정도 희생 할 수 있는 백신 맞은 예방 되는 아닌,35.47의 확률로 부정리뷰 입니다., 부정리뷰 입니다.,,,
공중파 가짜 뉴스 국민 개돼지,34.03의 확률로 긍정리뷰 입니다., 긍정리뷰 입니다.,,,
백신 맞는 죽는 보상 없는 거임,34.05의 확률로 중립리뷰 입니다., 중립리뷰 입니다.,,,
대한민국 보험사 만큼 돈 냄새 잘 맡는 없는 애 보험 출시 안 할까 잘 생각 해보는,33.75의 확률로 중립리뷰 입니다., 중립리뷰 입니다.,,,
백신 없는 뉴스 만들어서 선동 질 이냐,33.88의 확률로 중립리뷰 입니다., 중립리뷰 입니다.,,,
지인 의료 관계자 백신 맞는 이틀 째 온몸 마비 증상 와서 병원 응급실 갔습니다 적절한 조치 받고 나서 나중 괜찮아져서 나왔는데요 의사 차는 맞은 말라더군요 차 정도 심한 차는 죽 수도 있던 건강한 사람 정도 질병 있는 눈치 채지 못 살다가 주사 맞는 비명 횡사 분 있으리라 생각 되는,37.13의 확률로 부정리뷰 입니다., 부정리뷰 입니다.,,,
지금 백신 맞아라는 말 인 교 맞은 말아라는 말 인고,34.02의 확률로 부정리뷰 입니다., 부정리뷰 입니다.,,,
정 할 심 해서,34.59의 확률로 긍정리뷰 입니다., 긍정리뷰 입니다.,,,
뉴스 관계자 맞는 걸 아닌 하겠니 걸 사라 고 관심 갖는 척 하는,34.19의 확률로 중립리뷰 입니다., 중립리뷰 입니다.,,,
백신 맞아지 롤 떨지,33.75의 확률로 긍정리뷰 입니다., 긍정리뷰 입니다.,,,
명 어차피 죽 사람 이었는지 정말 코로나 백신 죽는 건지 인과성 성 제대로 따져야 신뢰 성 있는 명확히 하지 못 책임지는 있던 생각 함,34.22의 확률로 부정리뷰 입니다., 부정리뷰 입니다.,,,
기상청,34.63의 확률로 긍정리뷰 입니다., 긍정리뷰 입니다.,,,
안 맞은,34.06의 확률로 중립리뷰 입니다., 중립리뷰 입니다.,,,
난 안 맞은 거임,34.06의 확률로 중립리뷰 입니다., 중립리뷰 입니다.,,,
춘천 명동 입구,35.0의 확률로 긍정리뷰 입니다., 긍정리뷰 입니다.,,,
백신 면역 항체 개월 연구 결과 나왔고요 노벨 화학 상 받은 백신 장기 부작용 우려 깊다 하신 안 백신 부작용 전 세계 화장 터 될 거 고요,34.11의 확률로 중립리뷰 입니다., 중립리뷰 입니다.,,,
웃기는 고 있는,34.94의 확률로 긍정리뷰 입니다., 긍정리뷰 입니다.,,,
척척 박사,34.03의 확률로 긍정리뷰 입니다., 긍정리뷰 입니다.,,,
코로나 매왓 죄인 죄명,34.66의 확률로 긍정리뷰 입니다., 긍정리뷰 입니다.,,,
인과성 인 정 안 하는 게 자랑 이냐,33.93의 확률로 부정리뷰 입니다., 부정리뷰 입니다.,,,
마스크 써라 하는 진짜,33.75의 확률로 중립리뷰 입니다., 중립리뷰 입니다.,,,
백신 안 맞는 코로나 걸리는 죽는 코로나 걸리기 싫은 백신 맞은 죽었는데 개죽음 판정 됨,38.48의 확률로 부정리뷰 입니다., 부정리뷰 입니다.,,,
샌프란시스코 사는데 엄마 세 세 딸 살 차차 맞은 가까운 지인 친척 맞았고요 증상 차는 그냥 뻐근함 차는 몸살 기운 정도 걱정 마시고 꼭 맞은 여긴 있는 차도 맞은 거,34.07의 확률로 중립리뷰 입니다., 중립리뷰 입니다.,,,
주변 젊은 나이 백신 맞는 심장마비 돌아가는 분 명 되는,34.57의 확률로 부정리뷰 입니다., 부정리뷰 입니다.,,,
백신 맞는 심각한 부작용 거릴 확률 됨 죽는 그게 무서운,34.54의 확률로 부정리뷰 입니다., 부정리뷰 입니다.,,,
차차 간격 주 항체 제대로 생기려나 물량 확보 될 미루려고 하는 맞거든 건강검진 알레르기 반응 검사 최대한 안전한 장치 다해 두고 맞아야겠네요,34.31의 확률로 긍정리뷰 입니다., 긍정리뷰 입니다.,,,
백신 맞은 전 무섭다는 마음 백신 맞은 내 몸 악 영향 주지 않은 하는 생각 정도 두려운,35.59의 확률로 부정리뷰 입니다., 부정리뷰 입니다.,,,
경우 있던 백신 맞는 문제 있는 나라 책임져주는 모습 있는 하는 그런 게 안 보이니,37.41의 확률로 부정리뷰 입니다., 부정리뷰 입니다.,,,
배는 과장 고 배 넘기는 차이 임대 부분 사망 부작용 발발 사례 차 접종 아닌 차 접종 발생,34.2의 확률로 중립리뷰 입니다., 중립리뷰 입니다.,,,
백신 개발 하는 최소 수년 걸리는 데 급 조해 뚝딱 만들었으니 당연한 불안한,33.86의 확률로 중립리뷰 입니다., 중립리뷰 입니다.,,,
나도 젊은 층 백신 사망률 걱정 되는 애 맞히기 두려운 문제 백신 안 맞은 코로나 변 일으켜서 강력하고 치사 율 젊은 층 안 통 하는 그런 변 일으킬까 그것 무섭다,37.81의 확률로 부정리뷰 입니다., 부정리뷰 입니다.,,,
대이고 백신 맞는 째 부작용 고생 입니다 통풍 발작 다리 마비 증상 백신 맞은 병원 절대 부작용 아닌 데 지금 건강했고 요산 수치 발작 수준 아닌 그냥 높은 수치 였습니다 여러 병원 다녔는데 의사 의문 시합 이럴 수 없는 두고 보여 하는,37.6의 확률로 부정리뷰 입니다., 부정리뷰 입니다.,,,
차 맞는 고열 하루 고생 했으면 차는 고민 되는 무서워,34.17의 확률로 중립리뷰 입니다., 중립리뷰 입니다.,,,
백신 부작용 있던 해도 정말 정말 정말 운 안 좋은 사람 만 부작용 생기는 위험한 건 아닌 코로나 생기는 죽 확률 부작용 때문 생명 위협 가할 확률 높은 백신 맞는 게 안전한 확률 얘기 해주는 있는 목숨 걸어서 백신 안 맞는 분 존중 합니다만 사회 백신 맞는 게 예의,36.66의 확률로 부정리뷰 입니다., 부정리뷰 입니다.,,,
믿음 만 세상 아니네,34.62의 확률로 긍정리뷰 입니다., 긍정리뷰 입니다.,,,
독감 주사 후유증 후각 상실 걸리는 본 있는 안 맞은 생각 임 개월 돌아왔지만 예전 둔해진 같은 어차피 미세먼지 쁨 마스크 써 왔기 때문 마스크 거부 감도 적고 개인 사지 마비 큰 공포 갖는 있으므로 접종 순위 최후 밀려난 테 노력 해서 사전 예약 말 반 항심 드는 이유,36.01의 확률로 부정리뷰 입니다., 부정리뷰 입니다.,,,
솔직히 개 무서운 내년 나오는 국산 백신 기대하고 있는 백신 안 맞는 버티 자니 무섭고,36.19의 확률로 부정리뷰 입니다., 부정리뷰 입니다.,,,
나도 백신 예약 하긴 했으면 찝찝하고 무섭긴 남 민폐 끼치 기도 싫은 백신 안 맞은 불이익 당하기 싫은 예약 했으면 겪게 될 큰 작은 부작용 장기간 봐서 알 수 없는 영향 부작용 무섭긴 지나간 보는 알 수 있는 거 생체실험 체 되는 보는 보는 지금 선택 맞았는지 틀렸는지 알 수 있겠지 틀렸다면 아마 책임지는 사람 아무렇게나 없는 그냥 장기간 봐서도 큰 부작용 없길 바랄,38.22의 확률로 부정리뷰 입니다., 부정리뷰 입니다.,,,
백신 맞은 걸리는 악화 되는 치료받는 안 되는 수준 안 가도록 견딜 수 있던 장점 있는 애초 막는 거 면 치료받는 제라 고 하는 재수 없는 죽는 건 일반 독감 주사 비슷한 알 고 있는,39.97의 확률로 부정리뷰 입니다., 부정리뷰 입니다.,,,
모든 약 부작용 있 대서 진실 인지 모르겠지만 백신 사망 했으면 기사 매일 보 여서 개인 백신 맞기가 무서운 맞은 분 걱정 되는,34.75의 확률로 부정리뷰 입니다., 부정리뷰 입니다.,,,
일본뇌염 예방접종 안정 성 높은 실험 단계 끝나는 코로나 안정 성도 불확실하고 실험 단계,34.66의 확률로 긍정리뷰 입니다., 긍정리뷰 입니다.,,,
뉴스 내용 접종 확 진자 사망자 비교 어째 고 배 이러면서 강조 하던데 그것 확진된 자치 명률 봤으면 좋은 평소 언론 잘 나오지도 않은 확 진자 숫자 만 연일 강조 하던 데 백신 맞춰야 하는 비교 해서 배 만 강조 하는 뉴스 내용 확진된 자치 명률 있던 확진된 되는 치명 률 낮다는 이야기 입니다 그렇다면 경 증 끝나는 경우 많은 이야기 굳이 위험한 감수 백 신상 실험 동원 될 필요한 있는 의문 코로나 감 기 완전한 다른 감기 걸렸는데 시험 중인 약 개발 되는 먹으라면 먹을까요,36.38의 확률로 부정리뷰 입니다., 부정리뷰 입니다.,,,
인과성 성인 정박 려 면 해보는 함 애 당초 건강한 남성 주사 맞는 갑자기 죽었는데 인과성 없는 걸 믿음,33.79의 확률로 중립리뷰 입니다., 중립리뷰 입니다.,,,
언론 사망자 수 비교 하는 게 아닌 접종 받고 사람 죽는 사람 생기는 면 그게 문제 생각 해봐라 그거 안 맞은 살아있는 거 아닌 살려고 맞은 죽는 이보 비참한 있겠냔 말 이지,38.45의 확률로 부정리뷰 입니다., 부정리뷰 입니다.,,,
중요한 건 인과성 입증 절차 공개 해보는 진짜 인과성 있는 없는 모르니 불신 생기지 중요한 건 어쨓던 백신 맞은 죽 확률 있던 거 잖아 퍼센트 아닌 말 안 되는 확률 내 아닐 거 보장 못 받으니 불신 생기는 뉴스 보도 하는 게 맞는 불신 단체 생기는 면 불신 원인 해소 하는 방향 보도 해보는 합리 의심스러운 드는 걸 꼭 정책 반대 하는 나쁜 집단 만드는 무조건 보도 하는 답답하네,39.96의 확률로 부정리뷰 입니다., 부정리뷰 입니다.,,,
상 마루타,34.63의 확률로 긍정리뷰 입니다., 긍정리뷰 입니다.,,,
안 맞을래,33.69의 확률로 중립리뷰 입니다., 중립리뷰 입니다.,,,
간첩 선동 있는,34.16의 확률로 중립리뷰 입니다., 중립리뷰 입니다.,,,
실험 쥐,34.63의 확률로 긍정리뷰 입니다., 긍정리뷰 입니다.,,,
내용 뉴스 궁금했는데 감사한,34.63의 확률로 긍정리뷰 입니다., 긍정리뷰 입니다.,,,
무서운 다기 백신 관심 없는 백신 안 맞은 험하단 미치겠다,36.1의 확률로 부정리뷰 입니다., 부정리뷰 입니다.,,,
독도 땅 저딴 노래 만드는 버리네,35.0의 확률로 긍정리뷰 입니다., 긍정리뷰 입니다.,,,
